{
  "schema": "tessera.audit-report/1",
  "sample": "5d0c2b8f3e1a47c6b9d2e4f1a6c3b8d7e2f5a9c4b1d6e3f8a7c2b5d4e1f6a3c9",
  "manifest": "a3f19c7e2b5d8a41c6e3f7b2d9a5c8e1f4b7d2a6c9e3f8b1d5a7c4e2f9b6d3a8",
  "outcomes": [
    {
      "session_id": "0a1b2c3d4e5f60718293a4b5c6d7e8f9",
      "request_id": 3,
      "outcome": "accepted",
      "uhat_fixed": 0
    },
    {
      "session_id": "0a1b2c3d4e5f60718293a4b5c6d7e8f9",
      "request_id": 7,
      "outcome": "rejected",
      "reject": {
        "code": "REJ-ANCHOR",
        "request_id": 7,
        "kind": "Frames"
      }
    },
    {
      "session_id": "7f6e5d4c3b2a19087f6e5d4c3b2a1908",
      "request_id": 1,
      "outcome": "unproven",
      "unproven": "DeadlineMissed"
    },
    {
      "session_id": "7f6e5d4c3b2a19087f6e5d4c3b2a1908",
      "request_id": 2,
      "outcome": "inconclusive",
      "error": {
        "code": "ERR-RES-MEMORY"
      }
    }
  ],
  "summary": {
    "selected": 4,
    "accepted": 1,
    "rejected": 1,
    "unproven": 1,
    "inconclusive": 1,
    "max_uhat_fixed": 0
  }
}
